company_id,company_name
508274,"phuket rental service co., ltd."
513129,"phuket cheap tour co.,ltd."
426876,"boss land co.,ltd."
497380,master retail company limited
1043681,star avenue company limited
723459,p.b.t. group company limited
885035,pinkaew accounting & tax audit company limited
369027,bml company limited
475955,narula & sons company limited
512403,mclaren industries (thailand) company limited
186166,adm (thailand) company limited
85688,"party planner international co., ltd."
9963,heart and hand company limited
531681,bs family group company limited
250131,"it electric co.,ltd."
107528,"jet management co., ltd."
691260,a-z group company limited
712291,bangkok travel club company limited
1014982,somboon advance technology public company limited
59443,"saving energy co.,ltd."
96429,active lifestyle (thailand) company limited
223478,one healthcare company limited
293466,"lotus business management co., ltd."
710197,water pacific company limited
723433,dex company limited
262204,"horizon energy co.,ltd."
519085,new modern super pack company limited
1058881,smarto company limited
46499,"inside software co., ltd."
44938,"imagination co.,ltd."
631258,"neo line co.,ltd."
174015,"international business for africa and asia co., ltd."
75,"hyundai corporation (thailand) co.,ltd."
45739,"relax home co.,ltd."
757799,psg (thailand) company limited
526588,aps steel company limited
66087,strategy network company limited
297989,"h corporation co.,ltd."
63554,standard chartered (thai) asset management company limited
678546,next products company limited
919563,"siam pathumwan honda automobile co.,ltd."
238084,optima property company limited
3441,star business company limited
124048,l.e.k.company limited
144165,"industrial warehouse co., ltd."
574733,fresh flower company limited
42527,rank group company limited
1007891,chiangmai mining company limited
468728,"paul restaurant co.,ltd."
212101,"eclipse computing (thailand) co., ltd."
226838,greatertech company limited.
99097,"advanced wireless network co.,ltd."
1060433,smart properties(thailand) company limited
100193,"adventure center co.,ltd."
456875,gavroche company limited
5855,fresh restaurant company limited
56650,children fashion company limited
214322,green filter company limited
349137,"in exchange co.,ltd."
171468,international rubber company limited
92112,get solutions (thailand) company limited
54025,challenge training company limited
185171,"biowish co.,ltd."
459503,bowira company limited
362950,monday people company limited
421369,anubis consult company limited
527424,molnlycke health care (thailand) limited
68866,cook medical (thailand) company limited
287234,east heaven asia company limited
321855,"fortunate co., ltd."
574898,a.t. group company limited
893511,pitakkij company limited
728684,workplace solutions company limited
730762,pristina tours company limited
411079,otap company limited
221491,"dental hospital co., ltd."
982263,tmym international beauty group company limited
85110,total online solution company limited
266116,"cvd co., ltd."
427829,"focus media co., ltd."
686028,"ayudhya capital services co.,ltd."
225177,dynamic active company limited
261667,nice asian company limited
553100,"yodmala co.,ltd."
298290,"fnb silver co.,ltd."
814944,sharp formulator company limited
548101,fluid asia pacific company limited
326680,eins automation partner company limited
790012,well marketing services company limited
430843,"major entertainment co., ltd."
947210,siam business company limited
1000150,"smile siam printing service co., ltd."
1027313,sound design studio company limited
701601,travel head company limited
106815,h & a cutting works company limited
501421,devsign company limited
292894,easijet (thailand) company limited
542,wonder step company limited
334855,hands company limited
250353,dream enterprise company limited
950285,"t.s.d. co.,ltd."
220890,palladium company limited
699046,"trang travel co., ltd."
696163,premier education company limited
149423,gondola company limited
203630,"intan group co.,ltd."
689824,"ayutthaya metal co., ltd."
218183,dealcha company limited
2485,union jewelry company limited
386369,"d. group telecom co., ltd."
1057131,s. khonkaen foods public company limited
1065434,sujin textile company limited.
1028351,"s p c c co.,ltd."
558673,farm my company limited
484062,"mass technology co., ltd."
497841,msc consulting company limited
47286,resources international ltd.
669424,"pacific resort hotel group co.,ltd."
312448,jbc company limited
169848,j i l company limited.
890506,aktiv wise company limited
336591,"modern trophy co.,ltd."
93393,gourmet thai thai company limited
314358,nsc (thailand) company limited.
84763,"over oil (thailand) co., ltd."
909112,"planet english co.,ltd."
452014,digital image company limited
520439,"vuteq asia co., ltd."
870376,"saha group co.,ltd."
498544,xiang-hui international company limited
280802,"global geographic (thailand) co., ltd."
7695,proofreading company limited
827396,phet group company limited
337225,modo company limited
612345,mina intertools company limited
1014615,asia material supply company limited
281823,"health promotion center (thailand) co., ltd."
199014,diakrit ( thailand ) company limited
281089,"outsourcing factory co.,ltd."
993156,"skywave solutions (thailand) co.,ltd."
467253,management systems international company limited
884540,"pinthong co., ltd."
8854,also company limited
729687,agro group company limited
600892,"polar polar co.,ltd."
605485,"rtd (thailand) co., ltd."
274716,"j f trading co., ltd."
90779,"achievings co.,ltd."
703567,"buildyourjob (thailand) co.,ltd."
231933,irefer & telemed company limited
689498,p. and family company limited
626488,ltc group company limited
325581,"falcon services co., ltd."
70649,founder 29 company limited
381680,qps recruitment company limited
605256,k.s thai trading company limited
279432,paritex international company limited
816298,medic group company limited
1876,"united development co., ltd."
316921,als laboratory group (thailand) company limited
333844,infinity glow company limited
1046781,subway company limited
507203,victoria (thailand) company limited
125172,leo asia company limited
674432,"network solutions co., ltd."
236649,"proworks co.,ltd."
420067,"n a c (thailand) co., ltd."
272406,"hardy bigfoss international co., ltd."
9635,race parts (thailand) company limited
376608,bnj group company limited
51825,emergency asia company limited
515644,talent marketing company limited
111933,m s t (thailand) company limited
90955,a creation 1688 company limited
807160,"clinton marketing co., ltd."
46167,influencer company limited
507898,phuket ksysha company limited
504319,146 company limited
284081,cheno group (thailand) company limited
596369,faztwork company limited
492532,master ice company limited
133089,"js unitech co., ltd."
73014,never ending creative pr company limited
427284,"sunshine service co., ltd."
462406,"raja co., ltd."
307425,"almond (thailand) co., ltd."
930445,"power pa international co.,ltd."
91971,advance it support service company limited
460554,"music world co., ltd."
50316,eight o eight company limited
920191,"amex marketing co., ltd."
273468,"heang heang co., ltd."
52859,"showprocheck co.,ltd."
275711,kim international foods company limited
421776,"overdrive co., ltd."
512075,"ocean life insurance co., ltd."
617328,supply studio company limited
513880,"royal plaza co., ltd."
517327,"mdr(thailand) co.,ltd."
255414,haycox & associates (thailand) company limited
1040467,star fashion company limited
570808,"fast guard & service co.,ltd."
279473,nithipat company limited
321181,"nk-axis (thailand) co.,ltd."
279362,logistics channel company limited
702557,"worldwide thana co., ltd."
358090,kanape food company limited
256977,automation drive company limited
293135,lotte duty free (thailand) company limited
498440,direct family company limited
579108,"yong sanga co.,ltd."
728402,"a group supply ltd., part."
730935,"pago co., ltd."
516342,"ocean siam co., ltd."
755910,"people capital development co.,ltd."
107239,i-doctor company limited
576805,lucky dragon company limited
940336,bangkok mass company limited
133108,i'm one group company limited
232874,"profiplaschem co.,ltd."
504218,"development central asia co.,ltd."
7230,grayling(thailand) company limited
968399,siam inter group holding company limited
729899,"world education association co.,ltd."
272201,harikul group company limited
420949,nachuak printing company limited
235852,derek company limited
675235,traincom ltd.
729785,"suzuki automobile (thailand) co.,ltd."
727712,"pcs solution co.,ltd."
217990,d e a l company limited
520100,megla company limited
100972,"abcaso co.,ltd."
91379,adampak (thailand) ltd.
448192,empire engineering company limited
94610,"alto max co.,ltd."
237326,iseya company limited
43475,hi-tech imaging company limited
324679,"orchid villa co.,ltd."
722673,design media company limited
9786,radio broadcasting service company limited
275409,professional executive development company limited
448728,"quest development co.,ltd."
347634,"cellular group co., ltd."
85978,paypal (thailand) company limited
599661,fbp power supply company limited
99386,advance material company limited
547023,royal dragon restaurant
136055,impact engineering company limited
290932,gulf ipp company limited
961211,apm group solutions company limited
531220,"wide image co., ltd."
597706,mice guide company limited
321463,cpram company limited
313285,omron healthcare (thailand) company limited
73285,"gain co.,ltd."
232968,opssmart company limited
430107,mti services and supply company limited
758903,market right company limited
209252,gensign research company limited
84290,"opportunity co., ltd."
432659,"duo denim co.,ltd."
701166,premiumhomecare company limited
369905,data extreme company limited
112980,first light company limited
693586,norraphon adjuster company limited
721559,de siam company limited
151017,homerun company limited
258922,g o m company limited
804243,"akesit automation technology co.,ltd."
430442,"quark systems co.,ltd."
85634,"partner link co.,ltd."
547492,tawa inspection services and supply company limited
673787,netsol technologies (thailand) company limited
562522,"laser research co., ltd."
239438,"line engineering ltd., part."
494449,bravo music company limited
317162,j.r.w. utility public company limited
1029845,special network company limited
356435,money world company limited
298241,fnb company limited
248834,paradise place company limited
634927,tpm trading company limited
327292,"dusit group co., ltd."
891079,"siam ceramic co., ltd."
960987,"a p m service co.,ltd."
914774,bangkok cuisine company limited
187284,growth 88 company limited
292417,parisa company limited
428674,"quality survey co., ltd."
972712,"siam leather studio co.,ltd."
160480,j-global company limited
1038046,srinath products company limited
351838,hd medical company limited
892670,"siam okamura international co., ltd."
719651,prime land development company limited
383866,emc enterprise company limited
671804,realty one estate (thailand)
303534,hrms (thailand) company limited
578180,a & t inspection company limited
469808,environment partnership limited partnership
242412,"i solution service co.,ltd."
599680,rsp (thailand) company limited
454429,romeo company limited
562052,royal power group company limited
783570,p.t.k. company limited
153372,lab system (thailand) company limited
425629,"ny.la group co., ltd."
935985,"capital consulting group co.,ltd."
507198,a play music digital company limited
1006728,s n y company limited
319731,jci (thailand) company limited
698651,rematec & ksn [thailand] company limited
362399,"ntr technology co., ltd."
340439,n. s. r. group company limited
390489,"mostori co.,ltd."
327040,e-innovation technology(thailand) company limited
314885,"fortuna (thailand) co., ltd."
1058886,smart digital (thailand) company limited
692809,world magazine company limited
448317,"man group co., ltd."
721571,design 103 company limited
262745,"autowood co.,ltd."
1051410,"siri co.,ltd."
9842,application software service
7780,data advertising company limited
520777,royal cargo (thailand) company limited
301227,cumasuthai international company limited
468233,exdigiz company limited
414627,gabor enterprise company limited
1006874,asia farm (thailand) company limited
472799,pcl hospitality company limited
425304,yuan xin company limited
927880,"bangkok duty free shop co., ltd."
67926,"modern system co., ltd."
90448,"future solution technology co.,ltd."
930258,"power tools co., ltd."
71107,"system international consultant co., ltd."
460608,gdh 559 company limited
85044,topica company limited
277585,outsource nordic company limited
87372,"utility service co., ltd."
397343,oriental media company limited
587645,pny group company limited
693622,panna company limited
754363,triple tech company limited
7654,proof consultant company limited
317556,"drug master co., ltd."
737622,"peak and peak co.,ltd."
325055,eikou industrial (thailand) company limited
226087,"dental art co.,ltd."
188701,interact company limited
992593,cascada (thailand) company limited
186689,pro & pre company limited
84483,organize work company limited
269584,filmily company limited
56865,"link english co., ltd."
1003010,smp chemical company limited
262910,"auto construction co., ltd."
806176,tri energy company limited
1040845,"stainless pipe co., ltd."
751795,air energy company limited
904291,"tuscan co.,ltd."
288178,mixing table company limited
739774,business central consulting company limited
317452,"patango co., ltd."
593280,yonezawa company limited
598754,dragonfly (thailand) company limited
331746,modern thai company limited
284502,out of box creative company limited
999036,arte' company limited
305152,glur hostel company limited
399737,"original marketing co., ltd."
1008261,software innovation company limited
1069157,survey analysis company limited
929475,amnuay motor air company limited
4088,gm steel [thailand] company limited
161659,j-group technology company limited
215401,"profit management co., ltd."
992967,c asset company limited
373661,kantana post production [thailand] company limited
949858,antenna audio company limited
65551,store master company limited
69139,super brand company limited
534227,zen (thailand) company limited
54529,"present entertainment co., ltd."
460835,"phyll int (thailand) co.,ltd."
784581,"m d c c co., ltd."
107028,"hlm(thailand) co.,ltd."
704333,demco company limited
680049,"next communication co.,ltd."
253608,"liu liu ba ba co.,ltd."
331849,bakery house company limited
808049,pun company limited
127399,goll
151775,indigo development company limited
1032527,"s & r consulting co., ltd."
327208,pathom company limited
566999,plus pl-us company limited
91057,gas in company limited
230356,a g m s (thailand) limited
432597,major asia group company limited
329328,p s c g company limited
424562,sun smile holidays & travel company limited
234825,isa international company limited
565652,"fraternity co., ltd."
99532,advanced digital synergy company limited
1063748,st & c computer company limited
340329,forwarding services (thailand) company limited
242654,blooming company limited
498635,"direct network co., ltd."
399106,mountain partners (thailand) company limited
276617,"jhi international co.,ltd."
209134,palama-lapa company limited
287591,long bay resort company limited
951171,"communication innovations asia co.,ltd."
148080,je ngor plus company limited
264936,osp (thailand) company limited
694141,"world wide work co.,ltd."
215218,life compass company limited
123784,"padmavati diamonds co., ltd."
736800,world construction
1051643,"sirisub co., ltd."
54195,legacy golf [thailand] company limited
305206,b l i (thailand) company limited
310720,"bac co co.,ltd."
230950,greenboard cladding company (thailand) company limited
282690,hexagon company limited
399690,mozeal company limited
1078433,spark company limited
677674,reclamation (thailand) company limited
279606,"logonet promotion (thailand) co.,ltd."
910320,"conversant solutions co.,ltd."
98380,"advance co.,ltd."
251607,lycopenelover company limited
551397,zero factory company limited
219909,"geotech international co., ltd."
185470,ihr consulting company limited
1081818,solunic company limited
418626,bond international company limited
991586,casa design company limited
689407,ayutthaya part company limited
7367,activity club company limited
349194,"fortune asia co., ltd."
209536,k group (thailand) limited partnership
903647,consulting alliance company limited
326996,fali company limited.
315987,"ge capital thai operations co.,ltd."
284401,"gridline design studio co.,ltd."
67614,senior health company limited
316885,d ruj company limited
705055,"take it co., ltd."
1016422,asia industrial materials (thailand) company limited
149579,"jennifersoft (thailand) co.,ltd."
276719,kpmg company limited
537916,"cs mobility thailand co.,ltd."
675529,network system service limited partnership
359661,l o r (thailand) company limited
671563,"dahua (thailand) co., ltd."
730204,"waterproof renovation co., ltd."
322830,blue bar group company limited
179785,"diamond product co., ltd."
958518,tvs asianics (thailand) company limited
1040288,srt (thailand) company limited
394535,pay for you company limited
51828,emergency assistance (thailand) company limited
88283,water system company limited
499624,phukhao advertising company limited
730394,"prime color co., ltd."
267259,jtr golf group company limited
188326,grow up 2014 company limited
517566,engineering solutions company limited
231617,i r business company limited
507447,"new dimension co.,ltd."
280403,"eastern estate development co., ltd."
305705,"cj imc (thailand) co.,ltd."
328177,"n.k. silver co.,ltd."
211205,"koh chang lagoon co.,ltd."
259855,"auto house co., ltd."
227032,green tech overseas company limited
737801,business of accounting company limited
384530,dwp buzz company limited
331815,jwi sky company limited
601383,"freybar co., ltd."
235711,isabella company limited
85119,"total group co., ltd."
98210,advance time company limited
115664,j master company limited
100660,abc pathways international company limited
1059620,"smartrac technology co., ltd."
9214,"animal technology co., ltd."
326301,modern living company limited
248415,property review company limited
675748,"network data house co.,ltd."
877906,"t s a co., ltd."
708016,rental management company limited
672321,"pacific general contractor co.,ltd."
474780,"finixx new technology co.,ltd."
44696,ideal systems (thailand) ltd.
703515,"building service center co., ltd."
276518,heavenly blue company limited
338491,oil life company limited
47671,break time company limited
129108,"golden leader co.,ltd."
1078542,s. p. u. k. company limited
679198,supitcha group company limited
553517,bm tech company limited
57371,processing service company limited
596905,a t m s group company limited
281661,"global union express co., ltd."
572093,fast microservices (thailand) company limited
915054,constellation company limited
238740,"fun language international (thailand) co., ltd."
535827,morio company limited
729508,"suzaku co.,ltd."
940902,"compumation co., ltd."
303251,"fong tong enterprise co.,ltd."
915019,connecting dots company limited
551914,royal power
420627,"focus development co., ltd."
133661,aruna company limited
1079438,simulator company limited
555157,"lantana co.,ltd."
462676,"nara hotel co., ltd."
499264,"master interior co., ltd."
832082,"rotterdam overseas network (thailand) co.,ltd."
324849,"infinite grace co.,ltd."
909700,playn eyewear company limited
428327,"mtek computer & network co.,ltd."
1004126,ascension company limited
467118,nurture (thailand) company limited
307103,j o r company limited
283957,out-balance company limited
1082380,solutionnist company limited
294989,aw (thailand) company limited
151422,firefly (thailand) company limited
47026,"booking account co.,ltd."
120728,j-plan holiday company limited
472106,kotobuki company limited
986263,to fast company limited
334928,blufox (thailand) company limited
504560,en-green company limited
280741,"proacc accounting co.,ltd."
705690,worldwide group company limited
67066,consultant international limited partnership
503424,"engineering management & construction co., ltd."
182395,cna advance company limited
46176,informatics international company limited
677761,ayc (thailand) company limited
429118,"ornament textile co.,ltd."
1030948,s p land (thailand) company limited
1011223,"asia road co., ltd."
144466,"g & c account co., ltd."
459397,music development company limited
1041415,"star quality co., ltd."
222082,green innovation company limited
496077,nec platforms thai company limited
201404,image style company limited
424900,o. v. s. m. company limited
982150,cim engineering company limited
1002934,"art click co.,ltd."
498948,be wise (thailand) company limited
291224,gulliver company limited.
1014779,"asia tropic zone co., ltd."
465712,"ronglin import-export trading co.,ltd."
673666,"axis solution co., ltd."
47169,"international corporation co., ltd."
295947,professional trainer company limited
303531,"hrm service co.,ltd."
96173,"accurate technologies co., ltd."
709356,panyarat group company limited
289921,"chem-safe consultants co.,ltd."
522820,phuket creative company limited
466130,sun spa esthederm company limited
269894,k. owner company limited
677067,"pacific control systems co., ltd."
508474,phuket m & m company limited
290885,"gulf agency company (thailand) co., ltd."
899293,"bangkok building maintenance co., ltd."
727791,pcs technology company limited
580175,zinnia (thailand) company limited
322326,orchid marketing company limited
713608,design travel company limited
98110,"advance tech (thailand) co., ltd."
295602,"hilton pattaya hotel co., ltd."
1081447,solar supply company limited
95357,"absolute communication & events co.,ltd."
322372,leiter group company limited
731527,prime solution company limited.
1009030,asian explorer company limited
90656,"ace development co.,ltd."
1082088,solar roof company limited
493170,de ville group company limited
191391,job master company limited
516683,royalty stones company limited
493809,yakyim digital media company limited
189949,"pro-hero (thailand) co.,ltd."
49834,"cantab co., ltd."
728042,"bangkok film festival co.,ltd."
247324,helm thailand company limited
211280,"inter business marketing co.,ltd."
279771,b k g company limited
1037529,srichiangmai company limited
996495,u. d. group company limited
514969,"oceans below co.,ltd."
738449,"printing traffic co., ltd."
114467,i-thai engineering company limited
556529,cta engineering company limited
8027,"adviser communication co.,ltd."
994073,sky plus travel company limited
286523,"jinyi co.,ltd."
234551,"green trading & co (thailand) co., ltd."
351689,"es power co.,ltd."
423112,"focus property co., ltd."
462528,"quick management co., ltd."
218911,geowash (thailand) company limited
249777,i technology (thailand) company limited
9630,"designer gems (thailand) co.,ltd."
1026080,south view mansion company limited
486647,"yadee co.,ltd."
156626,gem's center company limited
591997,top product food company limited
86877,"united center co., ltd."
264317,"cheng saeng thai packing machine co., ltd."
66674,mindstree company limited
7119,"achieve realty co.,ltd."
242080,eagle business company limited
288732,owcha company limited
555744,nilkhosol company limited
156634,eco living company limited
662932,"synergy bangkok co., ltd."
1043168,star voyage company limited
190107,"grow international co.,ltd."
334163,"infinite vision co.,ltd."
63096,communication network
1038919,sri siam group company limited
522954,"royal executive marketing co., ltd."
266097,"jto home co.,ltd."
56044,"essential travel (thailand) co.,ltd."
1077263,spa marketing company limited
190135,"interink co., ltd."
196051,"co-science co., ltd."
675239,net group corporation limited
574533,freeplayo (thailand) company limited
510883,royal gem source company limited
301787,mobile vision company limited
556242,m.h.c (thailand) company limited
676394,"work icon techsolutions co.,ltd."
784865,"m design group co.,ltd."
54542,presenter professional company limited
128347,fabric spa company limited
535364,ohmpiang marketing company limited
1077841,"spa line co., ltd."
252882,"dga co.,ltd."
95392,absolute tropical garden company limited
1008497,softthai application company limited
337430,nsp business world company limited
43755,attention company limited
525403,"engineering depot co., ltd."
3969,"siam oil fat co., ltd."
432167,"prago (thailand) co.,ltd."
8937,delivery gas company limited
188319,group rondot (thailand) company limited
1015783,china auto parts (thailand) company limited
988260,"corporate house co.,ltd."
49922,"canadian education co.,ltd."
732270,"bangkok assets co.,ltd."
532941,"royal finishing co.,ltd."
443419,multi products company limited
904527,p k a group company limited
426971,madina (thailand) company limited
1078467,spa oil company limited
992086,cashgrow company limited
452679,quest company limited
251865,"himalayan arts co.,ltd."
735555,work and travel organizer company limited
518899,"royal marine container lines co.,ltd."
1004494,asean vinyl council association
287931,london restaurant
999874,china expert company limited
