company_id,company_name
1040746,standard group company limited
689865,panasonic siew sales (thailand) company limited
120836,"daniel development co.,ltd."
725019,agent trade services company limited
190083,"gross co., ltd."
50975,"electronic command center co., ltd."
730415,prime plus company limited
69457,copydesk company limited
553215,n h c company limited
468239,digital technic
471911,"express hotel co.,ltd."
275676,"nissin travel service (thailand) co., ltd."
71700,nativecom company limited
655759,"realeast co.,ltd."
726657,world class (thailand) company limited
1042727,star group company limited
526760,crystal food company limited.
90368,furukawa automotive systems (thailand) company limited
691053,"rejuvenate worldwide (thailand) co.,ltd."
329743,infinity thee company limited
95799,access design company limited
84509,tiny international company limited
1002457,art at all company limited
275477,"film master co., ltd."
598407,"wintech manufacturing co.,ltd."
9516,anyway company limited
215385,"h.v. fila co.,ltd."
397326,"oriental exposition co.,ltd."
48100,broadcast system company limited
193287,"jolly roger co.,ltd."
52667,"enable group co.,ltd."
513637,phuket real life company limited
615971,nature & living company limited
477491,kpam company limited
88529,west coast engineering company limited
545506,win win company limited
245803,hutchison telecommunication (thailand) company limited
824978,triumph group company limited
700444,trade group (thailand) company limited
133716,firmenich (thailand) company limited
189777,interglobal (thailand) company limited
341610,"fertility expert group co., ltd."
409363,"quality engineering services co., ltd."
314874,"niyada co.,ltd."
295504,"f & k group co.,ltd."
678,"general enterprise co., ltd."
313200,baezeni company limited
783527,voracom company limited
472077,"kothai co., ltd."
253346,paradise villa company limited
44480,hungry horse company limited
576417,bombay magic company limited
725444,pc-info service company limited
427597,"elite engineers co., ltd."
54566,"change logistics co.,ltd."
180839,biopower company limited
170933,echelon education company limited
191341,"diadem co., ltd."
420686,li-ho company limited
567785,"plumbing system co., ltd."
1040916,"star system co., ltd."
69422,"footwork co.,ltd."
46803,"body glove (thailand) co., ltd."
5369,d plus d company limited
213614,life voyage travel company limited
5229,jagota brothers trading company limited
406349,bonsai company limited
318378,hana hana company limited
177080,inter east company limited
725511,"world engineering co.,ltd."
398256,qualita (thailand) company limited
434314,"cube softtech co.,ltd."
224618,"gerard collection co., ltd."
578424,my store company limited
577529,naovarat surveying company limited
105750,"inovation engineering & production co., ltd."
255902,orthopeasia company limited.
1046770,subhachai electrical and communication company limited
600432,polytronics company limited
315444,"hana enterprise co., ltd."
560836,francom asia limited company limited
186592,"int it co.,ltd."
340035,blue glue company limited
7257,"active technology co., ltd."
302873,"hoei electronics (thailand) co., ltd."
326144,"dusit worldwide co.,ltd."
3484,moda design consultant company limited
578030,"wing world travel co., ltd."
1018752,asia renewable energy company limited
420438,"elite co., ltd."
511067,"ocean rice co.,ltd."
394974,nutrimed company limited
751920,"air park co.,ltd."
318623,modus hospitality (thailand) company limited
145514,"acinfotec co.,ltd."
332226,infinity communications & consultant company limited
85025,"package d co.,ltd."
516118,ocean property company limited
811669,phahana group company limited
547630,ms north star logistics (thailand) company limited
815963,media resource management company limited
509711,m c b company limited
50167,"policy service co., ltd."
719201,chue chin hua company limited
256331,"automatic system (thailand) co., ltd."
285672,easy listing company limited
450198,westbridge foods (thailand) company limited
561066,"pld supply co., ltd."
187880,knowledge management service company limited
494921,"best msc agency co.,ltd."
425185,"bosny paint co., ltd."
52871,"cellance co.,ltd."
577003,zighead communications company limited
289543,guism company limited.
278770,"logistics (thailand) co., ltd."
722068,design teak company limited
687432,precise corporation company limited
514813,vichitbhan palmoil public company limited
423633,"madera (thailand) co., ltd."
313633,d.r. group company limited
464801,"vp. systems co., ltd."
96707,action point company limited
739301,world business technology company limited
369566,federal transport company limited
74079,"gastrobiz co.,ltd."
385000,andaman coast company limited
357224,bay palace company limited
722043,"rexel general supply and services (thailand) co., ltd."
477629,expanets integrated solution company limited
300884,oka company limited
163189,"hotels & resorts design co.,ltd."
1081417,solution and development company limited
299941,ct premium pet company limited
674750,net work time company limited
517253,news consulting (thailand) company limited.
339817,aml technology company limited
733457,burasari company limited
93778,"alfredo co., ltd."
319027,dtac accelerate company limited
231188,dental smile company limited
514785,sunshine biotech international company limited
271465,"filter vision co., ltd."
1015427,asia stage company limited
55350,"chartis insurance(thailand) co.,ltd."
51983,"emission zero co.,ltd."
271348,health manager company limited
214863,"great engineering project co., ltd."
152218,icare corporation company limited
288059,hoffen (thailand) company limited
58230,civil m company limited
393791,p. a. y. group company limited
69992,move fitness company limited
330588,p s c m company limited
101577,care for life company limited
725411,p & c intertrade (thailand) company limited
677647,"pacific industrial co., ltd."
707217,world bridge
224244,green world aec (thailand) company limited
476413,decoration guide company limited
302373,mobile station company limited
235707,"nichidai (thailand) co.,ltd."
561861,royal group international company limited
296738,hiler tec company limited
214735,hitachi elevator (thailand) company limited
96032,account consultant solution company limited
935762,bangkok kids party & supplies shop company limited
431120,"mtu maintenance service center ayutthaya co.,ltd."
695659,advantek company limited
542101,m plus plus company limited
177638,grand design company limited
178817,"ifc inter-food co., ltd."
610027,k & t graphic company limited
291932,fairview international (thailand)
356592,olanga company limited
525386,news time company limited
94829,"ambient group co., ltd."
498451,"expert energy co.,ltd."
186020,genie construction company limited
425039,eliezer ventures company limited
760083,k fresh company limited
43980,auto & general (thailand) company limited
180125,integrated technology company limited
182343,"general diesel (thailand) co., ltd."
335489,infinite computing systems (thailand) company limited
9066,demanda company limited
8944,delivery thai company limited
223570,dentsu one (bangkok) limited
313202,"dab technology co.,ltd."
507281,g.k. land ltd.
516259,phuket diamond resort company limited
365772,"am service co.,ltd."
286117,"longer (thailand) co.,ltd."
1050099,shopseason company limited
350542,e-space technologies corporation company limited
737155,business information & research company limited
344490,blue water view company limited
707130,novartis services (thailand) company limited
272414,harley st hair centre company limited
524533,"kyowa casting (thailand) co.,ltd."
635559,"presidium instruments (thailand) co.,ltd."
232681,g. h. a. company limited
405611,m property solution company limited
322196,modena development company limited
270361,"mnc international trading co.,ltd."
545975,"farm fresh (thailand) co., ltd."
505554,engineering & construction consultant company limited.
1044088,"steel master design co., ltd."
48312,rice popper company limited
730197,"world supply group co.,ltd."
298592,"parts industrial co.,ltd."
340086,bamboo sinfonia company limited
883018,wealth streams futures company limited
721583,buritara development company limited
280373,logistics zone limited partnership
516629,phuket andaman real estate company limited
70349,for the people (thailand) company limited
269422,paragon studios company limited
350659,daradaily company limited
1077702,"spa & beauty co., ltd."
86840,"unique comtech co., ltd."
61248,speak easy company limited
384323,orange gold company limited
49091,cabina tomates company limited
4642,"accounting home office co., ltd."
2146,living server company limited
230116,fuji ace company limited
533093,phuket premium smallgoods company limited
1058853,smart forward company limited
803220,middle east center limited partnership
730355,"a group engineering co., ltd."
214595,great wall company limited
597437,"microsoft technology co.,ltd."
914853,"construction house co., ltd."
448283,y e j (thailand) company limited
5792,vistas development company limited
506162,"brain group co.,ltd."
737108,"water solution co.,ltd."
280252,park world company limited
290891,csr design company limited
68739,flowrider (thailand) company limited
9966,heart hospital company limited
722335,"design high co.,ltd."
53417,ceo advertising company limited
490364,white box company limited
657898,napoli company limited
73219,"newly (thailand) co., ltd."
700231,"building materials co., ltd."
330209,"modern development co., ltd."
392910,pavilion worldwide group company limited
1013939,asian oriental company limited
417342,webnext company limited
419975,quality treatment company limited
334057,pattaya square company limited
319227,dtac trinet company limited
298903,"global holding co., ltd."
1061769,"spica co.,ltd."
958999,bangkok business global company limited
213105,ihapstudio company limited
188259,international global management company limited
144255,"indochina innovation co., ltd."
57590,live lighting company limited
202878,"imagine graphic co.,ltd."
604610,freyabadi (thailand) company limited
401442,maxi q company limited
543895,praneat company limited
778520,buenaventura art gallery company limited
279923,eastmen shipping company limited
336116,liberty international (thailand) company limited
52404,shortcut one company limited
420911,overdrive company limited
3393,capital land company limited
952452,tsp printing company limited
541248,m&e systems design company limited
257528,park company limited
292111,csr alliance (thailand) company limited
246181,italthai hospitality company limited
271064,huddle company limited
679820,"advic co.,ltd."
49320,editor company limited
67044,consultant & training company limited
518426,"mega project co., ltd."
177343,intertrade enterprise company limited
744969,"pentangle promotions co., ltd."
1078939,sign works company limited
433049,"yugo industrial (thailand) co., ltd."
693685,"nori (thailand) co., ltd."
208784,genzyme (thailand) company limited
317125,education aec company limited
1062439,sport thai-bavaria company limited
514240,"engineering service co., ltd."
359604,blue assistance company limited
178166,biotech (thailand) company limited
339921,"ferric(thailand) co.,ltd."
6683,"a. boutique co., ltd."
227331,palicon pro art lighting company limited
103543,"hiring resources co., ltd."
578743,winpro property company limited
316495,l property company limited
61883,scope company limited
287735,global electric company limited
675950,net professional company limited
1019245,"asia business center co., ltd."
244278,isuzu motors (thailand) company limited
557792,p. k. t. (thailand) company limited
871106,"t r (system) co., ltd."
185762,a. thai company limited
1022921,c.maha-ard company limited
209063,k group construction company limited
45033,"region development co., ltd."
547647,sunrise (thailand) company limited
60907,"major network co., ltd."
501581,"n-tech machinery co., ltd."
7577,"prompt prompt co.,ltd."
55739,"life media co., ltd."
97917,advanced technology service
1050382,"shoppening co.,ltd."
713492,train asia company limited
47319,"bothong windfarm co.,ltd."
540806,"landmark development group co.,ltd."
721172,desjoyaux (phuket) company limited
292392,"east pr co.,ltd."
303634,hsm (thailand) company limited
718584,"prime box co., ltd."
575416,pmt (thailand) company limited
70311,council on international educational exchange ltd.
181232,diamond compass company limited
287730,progress part and die company limited
106717,hacker
878794,"siam holiday inn co., ltd."
342981,l m b group company limited
497252,nep group company limited
304625,blink group company limited
183066,"general hospital products co., ltd."
677097,network plus company limited
547439,royaltex knitters company limited
187345,kbs travel and intertrade company limited
467617,sunny international company limited
7869,"advance development co., ltd."
463268,"digital service co., ltd."
58755,software angels company limited
288037,hof group company limited
513396,exter group company limited
204671,imc innovation company limited
266612,bjc ogenki company limited
226766,d engineering design company limited
504803,engineering empower company limited
948929,siam nutrition company limited
84289,"opportunity asia co., ltd."
344816,galato company limited
679393,"trading and manufacturing co., ltd."
96846,action asia company limited
810015,"c l k co.,ltd."
188722,international commercial service company limited
1075040,"shine international co.,ltd."
450367,"boutique della pasta co.,ltd."
677823,"network quality management service co.,ltd."
357061,go up (thailand) company limited
1027779,south east beverage company limited
579295,my training center company limited
986230,"toffee land co.,ltd."
326434,"pat group co.,ltd."
1015184,asia one trading company limited
369351,"dscience co.,ltd."
129854,"gold class co., ltd."
720794,vast company limited
567607,"plus creation co.,ltd."
730725,world idea company limited
190022,general commodity trader company limited
949659,"t-scrap co.,ltd."
704087,"demo co., ltd."
99292,advanced engineering group company limited
505173,yusen logistics (thailand) company limited
314903,gdc company limited
351626,nt group company limited
631943,"teleone solution co.,ltd."
217088,efco (thailand) company limited
333770,amber supply company limited
208051,keystone enterprises company limited
758119,"kerry ingredients (thailand) co.,ltd."
285641,"csi group co., ltd."
45455,"incentive co., ltd."
254704,pro management company limited
83451,"object co.,ltd."
63259,"master mechatronics co., ltd."
546319,prapatporn (2548) company limited
304486,jasberry company limited
114767,care & fair logistics company limited
152531,home hub company limited
552840,lang hong
377608,d.t.c. enterprise company limited
218094,fusion interface company limited
1029890,"specialty innovation co.,ltd."
573666,ab normal company limited
192881,"bio ethanol (thailand) co.,ltd."
700633,dell solution company limited
85845,"travel wing co., ltd."
252434,parkroyal hotel limited
1057420,skin herb company limited
62450,"marketing and service corporation co., ltd."
982723,b.grimm trading corporation company limited.
309018,bacchus (thailand) company limited
547706,landmark company limited
45416,improve asia pacific company limited
142925,"golf working group co., ltd."
254503,"fbd (thailand) co.,ltd."
379185,cenixoft company limited
368296,"drw international co., ltd."
87949,visual & image company limited
127219,first one systems company limited
61695,extreme vision company limited
919844,pmec (thailand) company limited
385991,leader fleet transport company limited
370317,center construction company limited
91668,"add sound system co.,ltd."
339605,happy time marketing company limited
498743,"phuket beach resort and spa co.,ltd."
236358,derlite limited
54788,"president country club co., ltd."
993139,"castle tower co., ltd."
260449,"biz one co., ltd."
1050311,"shoes international co., ltd."
333820,daiso company limited
992668,"binaric co.,ltd."
218134,ia group company limited
926200,v service center company limited
201500,"diamond max co.,ltd."
191393,biomedia [thailand] company limited
380985,"beaful co.,ltd."
1049887,"showgan co.,ltd."
232640,"aunet (thailand) co., ltd."
445467,beston company limited
792225,welding equipment company limited
328261,leva company limited
215781,joinventure group company limited
728915,waterline company limited
863251,"phoenixtech japan co.,ltd."
1018473,asian crossway company limited
550816,"windsurf co., ltd."
480489,"phuket palm co., ltd."
501158,endeavour company limited
213740,geomatic group (thailand) company limited
8445,"agricultural supply thailand co., ltd."
513570,phuket aussie company limited
335432,liberty company limited
114124,luxury resort management company limited
455281,manac engineering company limited
788233,well core service company limited
930284,v. thailand limited partnership
468189,"aonang cliff beach co.,ltd."
93691,alert [thailand] company limited
54741,channel (v) (thailand) company limited
230183,opa company limited
470232,gheco-one company limited
51515,"portal access co.,ltd."
184937,"bioenergy development co.,ltd."
94612,"altogether designs co.,ltd."
675632,network evolution company limited
101183,b-sport [thailand] company limited
675409,pacific bay company limited
296180,part & tool company limited
377758,d carrier company limited
266657,"lmc automotive (thailand) co.,ltd."
514414,ap service and supply company limited
1023869,songpol part company limited
732834,bureau global company limited
567059,plus press company limited
1019919,clean electric energy (thailand) company limited.
320565,juniper networks (thailand) company limited
310390,edl lighting (thailand) company limited
280326,"logistic distribution co.,ltd."
446662,korn 2010 company limited
320074,eto engineer (thailand) company limited
402772,"u & w group co., ltd."
294146,"global mineral co., ltd."
200950,"dxp (thailand) co., ltd."
69233,supply plus company limited
87395,vacation asia international (thailand) company limited
438067,multi construction and engineering company limited
60940,scholars international company limited
73675,gang media company limited
48068,japanese food & beverage company limited
998219,sm corporation company limited
748497,"business management services co., ltd."
421215,sun service center company limited
749472,"cisg co.,ltd."
898051,"cn law office co., ltd."
567176,dongsung company limited
999501,"smile plus holidays co.,ltd."
47474,"investor' forum co.,ltd."
1042448,star pan company limited
479329,pgq company limited
275558,east asia company limited
477949,"mantech communication co.,ltd."
263498,dreamliner company limited
5136,"first media co., ltd."
209926,green environergy company limited
897480,"pixel co., ltd."
472625,pcl (thailand) company limited
236668,"aurora engineering co., ltd."
249429,line international group company limited
1077447,spa origins company limited\
244243,link bangkok company limited
43057,"diet food co.,ltd."
74274,gaysorn property company limited
85729,"transfer co.,ltd."
727627,"prime supply co., ltd."
339270,"hapag-lloyd (thailand) co.,ltd."
308698,"mahaporn co., ltd."
312605,forecast company limited
44957,battlefield company limited
559930,"top point (thailand) co., ltd."
325403,infinity engineering system company limited
89189,wordplay communications company limited
719502,resources management international (thailand) limited
301174,okawa (thailand) company limited
597469,winner inter plas company limited
216678,"cover earth co.,ltd."
1019457,som krob kid company limited
277215,locbond (thailand) company limited
359334,retailing technology company limited
527263,"prasad co.,ltd."
214068,hitachi chemical (thailand) company limited
737003,pearson education indochina limited
1010503,chic fashion company limited
88135,wanderlust company limited
8157,"de art co., ltd."
727124,"p creators asia co.,ltd."
326556,bluewhitered design company limited
578799,zinnia (thailand) company limited
1079825,simon group company limited
215226,"hi-tech chaiyaphum apparel (2011) co.,ltd."
107990,"i do co.,ltd."
995044,"skyhigh yachting co.,ltd."
190617,"knowledge management asia co.,ltd."
191146,growth (product) company limited
212359,intent(thailand) company limited
181721,"j l x co.,ltd."
421705,vns group company limited
411794,"enrich global intertrade co.,ltd."
281132,logistics master ltd.
123722,"lekstar group co., ltd."
1026869,southland rubber company limited
194948,inter service and supply company limited
691878,"delighted services co., ltd."
995,"single point co., ltd."
275732,d. f. t. v. company limited
518002,crm manager limited partnership
1018253,asian logistics group company limited
354560,maharaja company limited
199945,general limited partnership
304702,eat drink chill company limited
574404,viquasoft company limited
279486,cs accounting service company limited
989443,big shop company limited
383586,center containers company limited
430496,"m. t. n. s. co., ltd."
588457,"menora co.,ltd."
1006979,"asia city publishing(thailand) co.,ltd."
200202,"imas (thailand) co., ltd."
364316,"bluesharp co.,ltd."
96470,active life fitness company limited
565382,"plus sense co.,ltd."
171548,jiya company limited
514179,engineering maintenance solutions company limited
320896,eton company limited
276679,"exige design solution co.,ltd."
357118,lohaprateep next gen company limited
268353,hr plus company limited
1072132,suwon market company limited
48169,jewels de razas company limited
474602,mybox group company limited
360200,"revo group co.,ltd."
229337,holistic spa & beauty company limited
742465,"verasu group co., ltd."
308075,q-plus [thailand] company limited
587169,"p.n.v. group co.,ltd."
292185,jin international company limited
186628,"diamond center co., ltd."
729902,chunghwa telecom (thailand) company limited
424339,mademoiselle company limited
1026459,south east asia capital company limited
1085130,s&t international company limited
300826,"east sun properties co., ltd."
275494,park management company limited
8551,"a i m s. co., ltd."
385202,andaman spa resort company limited
85643,"partners japan (thailand) co., ltd."
320071,bainisys company limited
316045,"hansa creation (thailand) co.,ltd."
7933,"adventure pictures co.,ltd."
171320,"international properties co., ltd."
935732,"captusdesign co.,ltd."
496525,k s n group company limited
92759,"g m c (thailand) co.,ltd."
502522,dj food company limited
420040,quarry (thailand) company limited
309533,edale asia pacific company limited
594839,d-code networks company limited
497058,"rama express co., ltd."
47596,"brand connections co.,ltd."
502791,master engineering system company limited
305895,"pattaya orient co., ltd."
163211,"gems & factory co., ltd."
231208,dynamic group company limited
220121,"green trading co.,ltd."
302178,"okamura group (thailand) co., ltd."
543820,"royal foreign trading co.,ltd."
271529,harrington company limited
273573,"a.k. fashion co., ltd."
406918,robot automation company limited
335008,daiwa kasei (thailand) company limited
529215,"moresco (thailand) co., ltd."
461638,"musiclism co., ltd."
1059152,"smart drug co.,ltd."
551471,sunanta group company limited
207868,imf group company limited
209846,"k.group supply co.,ltd."
44628,"dishes t & i co.,ltd."
452248,vp leasing company limited
961365,"t.y.k. inter ocean marketing co., ltd."
542610,land sculptor studio company limited
306061,l & p company limited
1041323,"stamford sport wheels co., ltd."
98837,advanced technology packaging company limited
232638,hr consulting and talent pipeline company limited
527121,mold and part engineering company limited
417254,webiz company limited
685473,pan air travel service company limited
726950,"rung co., ltd."
556440,ct and c (thailand) company limited
219123,great management company limited
823447,"ultra co., ltd."
201612,gns professional company limited
597284,polymer creations company limited
965015,siamese heritage company limited
352807,i sky company limited
270303,c w s company limited
581551,bop logistics company limited
725374,"pcic (thailand) co.,ltd."
721440,designs to cherish company limited
508490,my audit company limited
1069959,suraphan biomedical research company limited
1046014,"studio bangkok co., ltd."
679715,brothers club company limited
217907,"internet service provider co.,ltd."
580324,kmf transport and service company limited
426893,sun moon star (thailand) company limited
475104,aoyama thai company limited
502589,"phuket beer co.,ltd."
609333,"ray team co.,ltd."
323652,daido (thailand) company limited
553616,"landmark siam co.,ltd."
365504,"data enterprise co., ltd."
676258,pacific laboratory company limited
1037553,"srithakral insurance broker co.,ltd."
69300,"food & fruit co., ltd."
193613,future energy company limited
364345,"edit design co.,ltd."
200332,future lifestyle company limited
1045048,steel alliance service center company limited
122319,first warehouse company limited
163861,hot food company limited
378051,open radio company limited
958409,"siam organic co.,ltd."
407242,e. m. thai company limited
43695,homerun consulting company limited
721141,"design-10 co., ltd."
698328,remark group company limited
248956,"it direct co.,ltd."
215808,"nd electric co.,ltd."
