company_id,company_name
273285,"east machinery co., ltd."
98034,advanced power and energy company limited
239307,island pools company limited
321992,ps business consultant company limited
290794,"csr communication co.,ltd."
692370,"premier home co., ltd."
223315,i.k.s. commercial company limited
507421,royal jomtien beach company limited
417851,"sunday home co., ltd."
677246,"work group construction c., ltd."
511215,brand road company limited
915395,bangkok painting company limited
673361,rebatemango company limited
576455,bombay magic suites company limited
328523,"dusit commercial co.,ltd."
73995,"dance synergy co.,ltd."
289576,kraft company limited
345618,"psi asia co.,ltd."
119237,"a b s s co.,ltd."
49363,"callington (thailand) co.,ltd."
325050,"infinity media co.,ltd."
370189,f. e. development (thailand) ltd.
426128,"klang & co.,ltd."
1058977,"smart search & services co.,ltd."
777602,"pte service co., ltd."
217590,one k. company limited
100183,adventure thai company limited
367480,"center trading co., ltd."
601834,"poly print pack co.,ltd."
547884,"ems engineering co., ltd."
734423,bangkok produce company limited
61359,"science service ltd., part."
427797,m technologies (thailand) company limited
84409,ticket to the moon company limited
532629,"phuket business group co., ltd."
1051272,sirichai broker company limited
693352,"north communication (thailand) co.,ltd."
532636,wide body company limited
700034,pandora services company limited
1059356,"smart technology co., ltd."
565040,wangnoi engineering company limited
420338,overland grand company limited
573119,viola company limited
1081452,solid unity company limited
508559,"engineering standard co., ltd."
65180,"concrete line co., ltd."
579563,drago 2009 company limited
446500,"queen's hotel co., ltd."
44247,"how co., ltd."
1045999,studio mano company limited
120618,"its technology co.,ltd."
531594,phuket charm company limited
98484,advance life company limited
282092,"nitigura (thailand) co.,ltd."
73689,gangster group company limited
276865,lock build company limited
60257,experience company limited
455179,best retail company limited
1046076,"studio architects co.,ltd."
92718,glow power technology company limited
324325,"inflight service co.,ltd."
502545,"vta power network co., ltd."
454646,"queen andaman co.,ltd."
1021404,"astoria co., ltd."
1058926,smart bomb company limited
459669,"music style co.,ltd."
730183,water line system company limited
369149,iq smart company limited
118186,kaiser biz company limited
587801,"rs components co.,ltd."
232223,greenlight samui company limited
292968,global standard (thailand) company limited
805241,k build & design company limited
182487,general power quality company limited
338891,i. q. knitter company limited
231776,candlelight group company limited
270138,j d i company limited
73264,news (thailand) company limited
676170,"yoshida co.,ltd."
500700,"direct construction co., ltd."
99391,"advance tech industry co.,ltd."
349827,cell therapy company limited
961116,chayakit company limited
448083,"best tech and engineering co., ltd."
331690,baker tilly management services (thailand) company limited
210568,"d.c.p. group co., ltd."
298016,love sun company limited
309469,eda international company limited
534414,laguna restaurants company limited
713517,world of food (thailand) company limited
383791,andaman enterprises international company limited
1013559,asia valley limited partnership
449917,"f. s. l. <thailand> co., ltd."
151632,"propaganda co., ltd."
202191,go dung company limited
329389,"info intelligence co., ltd."
404423,robin ruth company limited
519060,"new auto part co.,ltd."
737018,bangkok engineering co.
292472,global wireless international company limited
184127,progress plus company limited
1074502,"s.v. (thailand) co., ltd."
497118,"prasit group co., ltd."
675654,trading solution company limited
46492,"inside music co.,ltd."
215890,life wellness center company limited
282817,hexa thailand company limited
489106,sunix company limited
359194,retail application system company limited
504230,murray(thailand) company limited
744224,"verana press co., ltd."
193565,general service limited partnership
69844,"corporate consultants (thailand) co., ltd."
761298,marlik import & export trading company limited
547067,360 quality management company limited
526799,v.winplus company limited
372991,"open advertising co.,ltd."
340606,oizuru (thailand) company limited
184693,"huahin consultant co.,ltd."
361490,"jamal 47 co.,ltd."
422387,"focus suites co., ltd."
250014,"gift best co., ltd."
44746,base camp company limited
322153,for mom company limited
188008,"group enterprise co., ltd."
234087,dynamic company limited
729946,print center company limited
358247,kangwanthanawat company limited
470013,sun img company limited
331020,a m b group company limited
354299,red planet hotels (thailand) company limited
529775,faces company limited
311643,jay mart public company limited
554013,"p.k. factory co., ltd."
323532,"inflow line products co., ltd."
194425,professional systems limited
713599,watergate hotel company limited
737750,"business development co., ltd."
198874,"gunkul co., ltd."
587056,fashion boutique company limited
175447,"c u e co.,ltd."
89939,fruits bangkok company limited
52431,"lawyer friend co., ltd."
42580,helicopter company limited
446286,"anwill co., ltd."
506971,phuket lifestyle multimedia company limited
760098,p. s. k. p. v. c. company limited
46190,information technology system services company limited
234907,optimizer group company limited
114028,"nrg co.,ltd."
374407,e i c engineering company limited
806890,well supply group company limited
103353,in bay company limited.
470600,koshin (thailand) company limited
752301,"vnp development co., ltd."
717749,"printpack (thailand) co., ltd."
454922,ntp company limited
359597,"fourtech co., ltd."
868408,"piangpor enterprise co., ltd."
450729,"sunera creations co.,ltd."
248174,"helvetia co., ltd."
1040290,"srt design (thailand) co.,ltd."
738802,"trident group co., ltd."
414469,web design (thailand) company limited
598082,mi casa company limited
290430,global thai logistics company limited
578235,"my supply co.,ltd."
930450,power project management company limited
483084,express food group company limited
534782,zensorium (thailand) company limited
243776,isuzu global cv engineering center company limited
51783,"poseidon co.,ltd."
458789,bowman engineering company limited
914896,continental biomass energy company limited
720357,primrose group company limited
424615,yuasa battery (thailand) public company limited
52623,"should be co.,ltd."
206209,"diastar jewellery co., ltd."
1076903,"social investment & development co., ltd."
449460,quest asia company limited
437256,quality tour company limited
312961,"education bridge co.,ltd."
449543,boulevard company limited
192570,henkel (siam) adhesive technologies limited
568208,atelier pichita
536995,"aqua purification systems co.,ltd."
1017415,asian distribution company limited
1013325,asia resort company limited
625450,duality boat company limited
726728,"water analysis center co.,ltd."
253455,giovani company limited
246497,link (thailand) company limited
184517,"inter fasten co., ltd."
700,"eurostar co.,ltd."
62594,"commercial and entertainment co., ltd."
516798,"engineering electric co., ltd."
885062,vr excellence company limited
119097,lvh (thailand) company limited
302908,azbil (thailand) company limited
72667,function first company limited
423983,lion holiday company limited
277815,maeklong group company limited
500571,"master dealer co., ltd."
693052,panpages (thailand) company limited
708761,pandora resort company limited
992558,sky commercial company limited
902228,"conergy (thailand) co.,ltd."
63189,staff support limited partnership
329533,modern freight (thailand) company limited
256274,full moon company limited.
319175,"blue mango co.,ltd."
736309,business relations limited partnership
501997,"mts engineering co.,ltd."
57659,cigarette (thailand) company limited
320460,get energy company limited
625186,"super pipe co., ltd."
1059897,smart travel company limited
326267,"forever living products (thailand) co., ltd."
432432,nakhonnayok company limited
534300,more service (thailand) company limited
88601,whatever service company limited
459356,euro asia company limited
1060657,sme development company limited
188990,bio energy plus company limited
935620,siam city law offices company limited
51440,"large format systems co.,ltd."
103227,in brain company limited
891170,vrp engineering & trading company limited
60866,southeast advisory company limited
413805,lost horizon resort company limited
573658,"cyber com international co., ltd."
277335,global assets company limited
767621,vetta nine company limited
95166,"able success co.,ltd."
535590,domain property company limited
1082392,solid magazine(thailand) company limited
949098,siam asset management company limited
553597,top furniture import-export company limited
697149,"northern media co., ltd."
578865,chongroup company limited
382757,andaman wine company limited
257152,"jr energy co.,ltd."
517502,ton company limited
293758,"globlex holding management co.,ltd."
469358,"nara factory co.,ltd."
988443,"coral island resort co., ltd."
987587,tokan company limited
52700,"leader international development co., ltd."
1076764,societe generale (thailand) company limited
676232,"network leadership co., ltd."
300606,aylmer aaharn (thailand) company limited
51464,elite business group company limited
191016,dam construction company limited
48665,jump communications company limited
1512,san shi mining industry company limited
282857,"grh trading co.,ltd."
95581,absolute medical company limited
473724,d insight company limited
95623,absolute it consulting company limited
695845,"pan air booking travel co.,ltd."
544782,aquarium world company limited
295986,louis company limited
302401,mobit synergy company limited
325985,"falck nutec (thailand) co.,ltd."
315950,education guide company limited
327420,"mahr s.e.a.co.,ltd."
739003,ricoh manufacturing (thailand) company limited
422814,petchburi company limited
520505,phuket villas & homes company limited
90432,"fusionex co.,ltd."
215067,"great glory co.,ltd."
802848,ui service company limited
323361,"leisure industries (thailand) co.,ltd."
312258,lpi rack range (thailand) company limited
6762,abroad property company limited
939999,t.p.group company limited
449028,korach industry company limited
293291,"kraft accounting co., ltd."
292075,j and j system company limited
94855,"am-d co.,ltd."
643506,nidec copal (thailand) company limited
534192,new line group company limited
218560,"palm pavilion co., ltd."
544301,cso service company limited
499374,"endurance technology (thailand) co.,ltd."
1001125,smith and smith company limited
46881,intelligence system corporation company limited
429723,cto management company limited
474462,yg (thailand) company limited
993535,"cast & craft creations co., ltd."
232128,ag one company limited
5393,dplus intertrade company limited
709967,travel and fun company limited
733865,prime phuket company limited
718823,"resotel group international co.,ltd."
250609,linktuner solution company limited
116337,lux alliance company limited
297135,double a and a
708167,"bull riders incorporation (thailand) co.,ltd."
761098,richco group (thailand) company limited
49528,"educational services international co.,ltd."
506752,devsync company limited
385264,body system company limited
270576,"global business management consultant co., ltd."
9796,"desire n design co.,ltd."
431852,rolly tasker sails (thailand) company limited
311784,"modern technology co., ltd."
711431,"bangkok logistics international co., ltd."
229742,"holiday international (thailand) co., ltd."
1050514,shou group international company limited
170001,"inter laundry co., ltd."
795700,"well korat energy co.,ltd."
71540,takerng tour company limited
304722,faw (thailand) company limited
129001,golden ship supply company limited
94185,gravity intertrade company limited
451477,vp luxury company limited
509648,mycos technologies company limited
248318,dream express (dex) company limited
869598,tang company limited
500292,new born group company limited
805810,mcdamos company limited
98174,"advanced international co.,ltd."
217046,"hitachi asia (thailand) co., ltd."
431421,"k-mac vibration analysis co.,ltd."
357856,gpf property management company limited
204629,herbert (thailand) company limited
219773,"ic-supply co.,ltd."
346861,"jacob's jewelry co., ltd."
314393,"o-planet interior design co.,ltd."
149179,jena the third company limited
249500,paragon development company limited
396135,anju diam company limited
196339,"general sound co., ltd."
259745,j seven company limited
53980,enjoy (thailand) company limited
964900,ubon bio ethanol company limited
281118,"health and life design co., ltd."
1059150,smart digital solution company limited
552747,m group real estate company limited
369765,federal asia company limited
784790,"civic corporation co., ltd."
188449,"bio & green marketing co.,ltd."
920159,siam safety company limited
181041,at digital company limited
65424,seed asia company limited
526806,"zenith construction co., ltd."
190581,"knowledge group (thailand) co.,ltd."
734670,"bus assembly co.,ltd."
220510,intelligent it company limited
46540,insight education consulting
114389,golden cup pharmaceutical company limited
174502,"international procurement services co., ltd."
217941,aeon insurance service (thailand) company limited
520713,mega genius company limited
301511,"mobicoat co.,ltd."
260042,auto transport company limited
506239,tongson company limited
313046,"aloft design co.,ltd."
178130,"jky concept co.,ltd."
825593,b w g company limited
767740,"mariner group co., ltd."
188426,"grosswell co.,ltd."
186486,"inter management system co., ltd."
251444,organic design company limited
8942,delivery technology company limited
935269,capital advisory services (thailand) limited
568642,rpg corporation company limited
541861,m&e supplygroup company limited
164675,ideeli company limited
193930,"professional technical equipment co., ltd."
391005,legal alliance company limited
136470,j. tech company limited
229024,limcharoen plating company limited
8095,affection company limited
194606,a.dusitnanond architect & associates company limited
420159,mse (thailand) limited
291575,"janesak travel co.,ltd."
100723,by train company limited
49137,rise accel company limited
460732,digital enterprise company limited
360154,data capital company limited
910037,connect business company limited
718773,"a & f planner co.,ltd."
568662,abloom company limited
475404,"zaki & company co., ltd."
1081975,solid work (thailand) company limited
175469,htm takahashi (thailand) company limited
208916,"pro-concept co., ltd."
792690,u-globe intertrade company limited
134125,golden link company limited
383908,katoen natie (thailand) limited
450202,"rajdamri plaza co., ltd."
181382,i.f.(thailand) company limited
251387,link rent a car company limited
84986,pack shot company limited
534673,more entertainment company limited
95881,access information system company limited
398893,maxhome and decor company limited
52231,shopping computer company limited
93932,align technology (thailand) company limited
511618,friend group engineering company limited
59087,"lotus international thai co., ltd."
1082451,solar power technology company limited
494006,phunkarn company limited
1063306,"s p v i co.,ltd."
204670,"heritage development co.,ltd."
110727,hammerhead marine company limited
498903,"ohara (thailand) co., ltd."
294886,"lotus development co., ltd."
1059309,"smart intertrade group co.,ltd."
1001862,smile equipment company limited
552762,m groups company limited
190211,"property shipping international co., ltd."
725577,water projects (thailand) company limited
369569,amway (thailand) company limited
181809,grand digital company limited
496664,fitness [thailand] company limited
377575,maiden dish company limited
792801,"pharinas co., ltd."
538517,land & road company limited
7038,"accountant co.,ltd."
455308,"digital connect co.,ltd."
98984,advance orthopaedic solution company limited
424846,e & l international company limited
613965,"miracle mushroom co.,ltd."
509949,"engineering world co., ltd."
532434,enlist company limited
428128,best car (thailand) company limited
1060171,smart global logistics company limited
364903,kr steel company limited
352153,celeb beauty company limited
516252,ocean bags company limited
102160,img (thailand) limited
50198,egg digital company limited
184705,grand castech company limited
366106,four partners company limited
1081679,"solution construction co.,ltd."
221280,koh samui adventure group company limited
124854,d. o. f. (thailand) company limited
1015589,asia energy green (thailand) company limited
163734,"pro co., ltd."
424691,quality project company limited
802468,"well quality co.,ltd."
563206,"mikuni shoji (thailand) co.,ltd."
1057586,s & k intertrade limited
1062532,sport product company limited
819846,"median co.,ltd."
527717,"new bangkok measuring co., ltd."
376751,andrew biggs company limited
564978,laundry pattaya company limited
285649,easy golf booking company limited
377893,lead engineering company limited
217506,inter focus (thailand) company limited
8618,"public park co.,ltd."
445456,managroup company limited
67636,"senior marketing co.,ltd."
349549,esl education company limited
687413,"y p k (thailand) co., ltd."
449526,quest drop (thailand) company limited
122618,padaeng industry public company limited
1046559,subsea offshore services company limited
730311,"suzuki automobile manufacturing (thailand) co.,ltd."
44412,bakery s company limited
96059,"accounting department co.,ltd."
189184,groovy map company limited
1083634,sorawat development company limited
56528,chief [thailand] company limited
571686,cyb company limited
297911,part plus company limited
245284,dreamworks fabricator company limited
185745,interpublic ( thailand ) company limited
1062221,s p o c company limited
433057,g-art company limited
503343,brand young company limited
151462,"proflex (thailand) co., ltd."
245443,cbi (thailand) company limited
311441,jay dee international traders group company limited
542594,land form company limited
540417,new work company limited
535860,newgen inter trading company limited
609912,toucan travel asia company limited
189046,"group 3 management co., ltd."
191431,one group company limited
94824,ambience studio company limited
327298,juthamas logistic company limited
355700,amora company limited
47241,internet thailand public company limited
458934,"music associate co., ltd."
194550,"i k w co.,ltd."
578949,to phuket company limited
306424,haf collection company limited
192870,inter holding company limited
1037044,sri trang agro-industry public company limited
355170,"it one co., ltd."
596702,d consult company limited
1046173,"studio 1 co., ltd."
135365,g a s company limited
1001150,smile plus network company limited
266367,"hpk (thailand) co., ltd."
1010938,asian business group company limited
550680,top technology company limited
677748,training and health company limited
94821,ambience company limited
956901,campus suite company limited
94660,alumni research company limited
1082402,solution link company limited
385484,era oilfield service (thailand) company limited
463290,digital shop company limited
152063,icar asia(thailand) company limited
737697,"bangkok pride co., ltd."
707265,"novitat co.,ltd."
87326,userscientist company limited
165728,inspired english company limited
1070702,"su thai sing co., ltd."
878015,"pimalai resort & spa co., ltd."
43137,rawdevelop (thailand) company limited
279792,"logistics products integrated & consultant co.,ltd."
919614,connection lathe services company limited
215125,green management & consultant company limited
335445,j y p company limited
431948,be strong company limited
322921,"form star co., ltd."
620659,c holding company limited
909716,alpha d.i. (thailand) company limited
417854,"m r & t co.,ltd."
497163,ms chemitech company limited
46568,inspire advisory company limited
676436,"work work engineering co.,ltd."
498389,"xian-ning seafood co., ltd."
1063596,s t c company limited
54969,environment development limited partnership
351089,"nobilis-thai co., ltd."
388157,gimmicksystem company limited
728458,"prime international co., ltd."
284190,global crops company limited
219458,"inter consultant co., ltd."
301448,double two company limited
131163,"cartoon studio co., ltd."
736827,bangla company limited
737127,business data center company limited
84945,tool construction company limited
345453,for community company limited
92889,goatrade farming company limited
265570,night business consultant company limited
311085,backy travel company limited
987634,cornerstone company limited
211976,great kitchen restaurant company limited
459385,"managed care co.,ltd."
1044155,sterling gems (thailand) ltd.
209446,e-business company limited
64000,fashion studio company limited
429071,vbest group company limited
249737,"east asia oil co.,ltd."
247475,link media group company limited
726989,"world group trading (thailand) co., ltd."
87924,"visionary group co.,ltd."
59348,clinic home (thailand) company limited
220067,"i c y co.,ltd."
183554,grace international company limited
311090,"modern fashion co., ltd."
252468,hi q food products company limited
377623,leader telecom company limited
248896,"paramee co., ltd."
427891,mte limited
187509,"bio energy technologies co.,ltd."
544521,dominion company limited
510604,"engineering consultant & supply co., ltd."
420760,"overseas freight services co., ltd."
459093,digidia company limited.
1058781,smarttech technology company limited
426802,m t c w company limited
43953,"authorize inspection (thailand) co.,ltd."
718830,designers field company limited
603743,polipharm company limited
677760,net engineering company limited
258913,"auto research co.,ltd."
58891,promise (thailand) company limited
1081624,"solana co., ltd."
725697,"pcj international trading co.,ltd."
863916,up and up training company limited
534018,cryotech asia company limited
48564,joy travel service company limited
275804,m n o (thailand) company limited
323656,jungheinrich lift truck company limited
180051,hua in company limited
144251,"professional wave co., ltd."
385262,"dg engineering co., ltd."
752274,"vertex engineering co.,ltd."
1042819,star moon company limited
721322,world part group company limited
5983,triple d group limited
279892,eastern trade company limited
924695,to build company limited
64681,medicalmap international company limited
536003,mergemate company limited
2997,wilding golf company limited
377957,b.n.s. incorporation company limited
792726,bt metal company limited
246461,"liner class co., ltd."
429274,"focus construction co., ltd."
675120,dasiri company limited
251090,fukui byora (thailand) company limited
1045057,"step stones ltd co., ltd."
183337,ignite roi company limited
713537,"pasha co., ltd."
508330,development business & travel limited partnership
504379,phuket union company limited
194745,heng lee co.
749834,triple i air express company limited
324543,orc premier company limited
52127,shopback company limited
737220,"rickter composites co.,ltd."
58168,"location (thailand) co.,ltd."
48147,revolution ptc company limited
966596,bdc (thailand) company limited
188432,"group club co., ltd."
269066,"i zone co.,ltd."
472576,p.c.l. company limited
258206,"hobby world co., ltd."
45640,increase resultant industrial company limited
209964,"palm resort co., ltd."
884359,s.a. intertech company limited
218005,"diversified (thailand) co., ltd."
66903,structure architect company limited
543157,"land and home property co., ltd."
816262,"sabai sabai at sukhumvit co.,ltd."
730309,agrow enterprise company limited
218313,"at w co.,ltd."
240755,de trading company limited
885084,saimai hospital company limited
319008,dtac
695120,"north thailand products co., ltd."
1006782,"asian solutions co.,ltd."
1080983,"s.n. trading co., ltd."
220114,"denso sales (thailand) co, ltd"
429477,"best performance co.,ltd."
234275,green paper company limited
698735,"water lily group co.,ltd."
953612,banchongpack company limited
202770,bistro amarone company limited
600423,"at office co.,ltd."
454453,best service system company limited
309521,b-accounting company limited
570320,"p m c i co., ltd."
340516,model club company limited
513885,"bfits (thailand) co.,ltd."
255077,living free ga development company limited
675059,bronco (thailand) company limited
384505,mapsiz company limited
214920,dive asia company limited
508429,phuket dream company limited
255818,fca(thailand) company limited
137009,impact development company limited
565766,"plus sale co.,ltd."
721170,"takraf (south east asia) co.,ltd."
502108,massive production company limited
517656,"a.p.s. design and consult co.,ltd."
484518,"gianni co.,ltd."
671638,"pacific kitchen co., ltd."
101658,"arlymear travel co., ltd."
113890,le beau company limited
767976,"kirz co., ltd."
318714,"alsco textile services co.,ltd."
226612,"fuji oil (thailand) co.,ltd."
381,sunny estate company limited
594862,"d-conceit co.,ltd."
1003238,"art martin (thailand) co.,ltd."
592715,fresh & fresh company limited
475177,"my decor co.,ltd."
