company_id,company_name
676151,training center services company limited
331468,"ekarat engineering co., ltd."
342768,happy properties company limited
362957,m a i t company limited
346444,monza company limited
274759,jftb company limited
48299,rice marketing company limited
408185,"n.v.k. inter co., ltd."
458265,"music moment co., ltd."
198930,"heidi nine intergroup co.,ltd."
149328,"j. engineering supply co.,ltd."
792531,"welter sea co.,ltd."
509675,yw collection company limited
422773,"quality assistance co., ltd."
230150,black forest company limited
1018957,"asia executive property management co.,ltd."
1049505,success life(thailand) company limited
61588,management and training company limited
541737,mesolve automation company limited
58189,"profile engineering co.,ltd."
567441,plus chemical company limited
765822,"marketing group co.,ltd."
1011745,asia business consulting company limited
395996,mountbatten company limited
1060951,"s n o co.,ltd."
204401,intelligent billing company limited
714214,trading base company limited
921620,pmw company limited
46193,billboards limited
668836,pacthai international company limited
214290,professional media company limited
225672,i-plus group company limited
444153,"boutique newcity co., ltd."
427645,elite management company limited
470058,"best project trading co., ltd."
461342,"vegas development co., ltd."
546328,e. m. a. company limited
513876,"phuket safari travel service co., ltd."
98968,advance project group company limited
295712,"eastern sea exploration co., ltd."
172219,"inteq co., ltd."
214732,life property management company limited
596086,praxis asia company limited
236961,greater group company limited
412778,"best buy tickets co.,ltd."
444783,digital one company limited
466278,"envimed co., ltd."
372127,"d.s.k. co., ltd."
679619,"next heading co.,ltd."
327246,bluework company limited
334573,p.s.c. company limited
1049077,"success writer co., ltd."
42825,"artisan co.,ltd."
278948,healthy ho company limited
935444,"amp advance (thai) co.,ltd."
724841,pc asia company limited
258244,hobs international holding company limited
3709,"radiant gems (thailand) co., ltd."
1049600,"success asia co., ltd."
213084,divine yoga company limited
335475,path
357603,"evonik united silica (siam) co.,ltd."
240555,human siam company limited
679578,refined energy company limited
343454,happiness(thailand) company limited
196938,"jomtien property co., ltd."
1051230,siri furnishing company limited
1086119,sugar baby company limited
201296,interhides public company limited
289489,"global access international co., ltd."
283568,"global marketing solutions (thailand) co.,ltd."
339760,aml global limited
425266,"focus consultant co., ltd."
818225,media network company limited
673092,pacific tools company limited
346755,have a good day company limited
275366,lobster company limited
406124,gmp cosmetic company limited
353246,itc south company limited
232118,black crab diving company limited
474077,best of health company limited
676913,training & management alliance company limited
1039862,srn group (thailand) company limited
1059674,smart service corporation company limited
7105,"grand thai group co., ltd."
301706,family group
214194,interactive products company limited
710958,trafcorp company limited
508684,my angel company limited
914670,alternative wealth services company limited
882123,pinadda company limited
310316,"edl co., ltd."
119593,i.t.solutions asia company limited
233979,optimise solution company limited
296164,proper company limited
113337,cargonet worldwide company limited.
186448,athens distribution company limited
6811,absolute beauty company limited
213920,"geotech-engineering service co., ltd."
436784,symate solution (thai) company limited
422869,"overseas pacific consultant co.,ltd."
224498,"germana industrial group co.,ltd."
100381,advice holdings group company limited
380640,beautiful day company limited
67845,content is king company limited
230040,iqmc
306966,"bliss services (thailand) co.,ltd."
424444,pet products ltd.
301418,double t company limited
258857,nichanan company limited
675435,pacific supply and service company limited
788551,voyage media international company limited
181851,"navy consultant co., ltd."
507339,royal garden company limited
674807,pacific insurance company limited
721886,support group limited partnership
1032228,"sra group co., ltd."
420232,"wemcon co.,ltd."
331507,"infinitas co.,ltd."
290962,albedo company limited
894414,we clinic company limited
694473,premier b company limited
515067,english online company limited
87483,"value design & consultant co., ltd."
7426,group way
818425,"medical tech co.,ltd."
115787,hong fah (thailand) company limited
1059756,smart media group company limited
467175,quizzbizz (thailand) company limited
296311,"easy com co.,ltd."
190239,"group one supply co., ltd."
1060564,smart business group company limited
500280,bewtech company limited
1042419,"stamford u.k. co.,ltd."
982135,"b f t co.,ltd."
547297,farmgroup company limited
270911,"easter co., ltd."
593109,yaokun machinery company limited
446820,ns intersupply company limited
436751,chock chai company limited
214987,joaw jwee company limited
1005552,chiangmai honey company limited
992751,binary line company limited
675368,neth plus company limited
869848,sahasavas
613247,"supanit co., ltd."
295971,progress group limited partnership
986615,bigkidinoffice company limited
446383,multi work group company limited
1048967,success international marketing company limited
387324,"pattaya leisure co., ltd."
255408,"living in bangkok co., ltd."
191758,grop (thailand) company limited
364732,"edit co., ltd."
9692,"hat service co.,ltd."
283036,jin thai limited
199810,international concept company limited
428445,quality assurance certification company limited
535192,zen restaurant group company limited
547253,aquafit company limited
499678,white beauty company limited
158813,icon travel company limited
444504,"multiple products co.,ltd."
427258,rainbow trading (thailand) company limited
456274,digital plus company limited
749717,trinity group corporation company limited
734841,"print site [thailand] co.,ltd."
216575,"join us co., ltd."
511006,ocean divers company limited
417674,web solutions (thailand) company limited
182334,j m c i (thailand) company limited
261275,bizz backup company limited
182793,"frontline engineering co.,ltd."
181596,"international aviation management group (thailand) co., ltd."
251039,"j & p intertrade co., ltd."
232011,kong sin company limited
982421,"tn asia co.,ltd."
235574,green terrace company limited
328807,infinite horizons company limited
897916,"piya ayutthaya electric ltd., part."
215223,hi-tech chaiyaphum apparel company limited
468456,"d e c m co., ltd."
8435,agricultural energy company limited
108988,"lumpini park tower co.,ltd."
235290,blackhawk company limited
507846,"mbk entertainment co., ltd."
281644,health and beauty marketing company limited
512287,phuket evolution company limited
468419,nusasiri public company limited
52745,"celebrity club co., ltd."
177450,"grand best co., ltd."
898627,siam lubricant company limited
8062,"advocate law office co.,ltd."
690169,"supply chain operations co.,ltd."
586492,mela garden company limited
943315,siam vitality company limited
188891,"group development co., ltd."
513595,phuket condos & homes company limited
1082122,solution nine company limited
577824,my service company limited
766254,"khemtit travel co.,ltd."
497055,vgi global media public company limited
9332,answer construction company limited
748858,business management asia company limited
1041208,"star animal health co., ltd."
512548,phuket management company limited
1075153,shippo asahi moulds(thailand) company limited
674994,transtel engineering (thailand) company limited
47794,"islander co., ltd."
220634,auburn asia company limited
1074979,shin nippon machinery (thailand) limited
181939,nava design studios company limited
177439,"bio thai supply co.,ltd."
727485,supa (thailand) company limited
188006,omni trading company limited
507753,be your travel company limited
477211,zam & co company limited
60087,clue ei centre company limited
84376,order group company limited
244298,isuzu technical center (thailand) company limited
385254,"leader tech co., ltd."
983751,"b i c ( thailand ) co.,ltd."
501896,m t s p company limited
689278,p and n (thailand)
63961,secret character company limited
86708,"photo expert co., ltd."
320878,ns gas lpg company limited
433938,oakley company limited
42603,hello service company limited
559451,nippon express (thailand) company limited
424446,"elite property consultant co.,ltd."
989791,cpta (thailand) company limited
528695,"factory support co.,ltd."
737368,prima laser therapy company limited
54016,"challenge industry co., ltd."
1041863,star network company limited
571969,atelier group company limited
350228,p & s industry company limited
600520,win global company limited
1086425,sukhumvit 81 company limited
674935,"pacific international development co., ltd."
348441,daramic (thailand) company limited
183222,"hua hin yacht club co.,ltd."
995420,arinc (thailand) company limited.
63905,star entertainment company limited
72161,fromm plastics asia company limited
555321,pk interfreight company limited
456829,"d & a entertainment co.,ltd."
1009824,"asia group steel co., ltd."
73124,"curious co., ltd."
580356,praram group company limited
243849,automation and industrial technology company limited
727456,bangkok land company limited
6002,"sun & sea travel co., ltd."
448185,nakai group company limited
311425,"j a y co., ltd."
218158,n.d.rubber public company limited
284907,eastern digital company limited
113706,golden bamboo company limited
313549,"pattaya laguna co., ltd."
48514,"bullet master co., ltd."
58055,"citizen kane co.,ltd."
354502,it consulting & service (thailand) company limited
147312,home & garden company limited
507347,mbi international company limited
209227,future marketing company limited
380313,mongkol import export company limited
762480,perfect technology company limited
475711,ap business group company limited
510492,d & f service company limited
253145,itls (thailand) company limited
722865,pbsoft company limited
599198,naturtech foods company limited
707253,"world ed. co., ltd."
987915,core design company limited
581796,mcinnis cit company limited
477048,expert education company limited
676314,transturbo technology company limited
790679,metrorich & stable garment company limited
960771,siam s & a intertrade company limited
304054,jasan & angel company limited
229391,green portal company limited
783472,rm consulting (thailand) company limited
992060,"skyworth (thailand) co.,ltd."
903646,pj trade enterprise company limited
541784,aqua
326068,le prestige company limited
494126,"expertise co.,ltd."
62192,comfort group company limited
553349,"f m g marketing co., ltd."
192138,group management and transport company limited
554969,lanex group company limited
711636,"pasak co., ltd."
929293,"tbs co., ltd."
184454,diachrome chemicals limited
92381,advisor tech and trade company limited
267071,j-trend creation (thailand) company limited
271479,ethosenergy (thailand) company limited
730987,"water first co., ltd."
516730,md hospital limited
209553,"general software co., ltd."
429425,ornsirin company limited
506898,kurz (thailand) company limited
719593,tre company limited
115538,lechler-thai company limited
1011924,asia excellence company limited
61796,manager engineering limited partnership
675225,recreational bangkok biking company limited.
188397,"general cooling co., ltd."
347585,montalak group company limited
695041,panini residence company limited
90317,accessories lady company limited
378208,"rl counsel co.,ltd."
281378,"global air freight co., ltd."
704056,demeter corporation public company limited
1045828,"stuvik racing project co.,ltd."
256979,living wise company limited
291105,"eastern arts ltd., part."
247548,j.p. audit and consult company limited
349258,"amo co.,ltd."
599284,win win foods company limited
1079007,sig -asia company limited
308258,a.l.m.t. (thailand) company limited
111325,"c w t (thailand) co.,ltd."
792349,me too(thailand) company limited
789598,v. i. d. company limited
671219,preedee air service company limited
85315,tower design company limited
870273,"siam asia co., ltd."
315666,drone service (thailand) company limited
270659,maepim company limited
56595,limitless group company limited
930068,"bangkok dance co., ltd."
473150,fine art marble floors company limited
471808,rak computer &network company limited
332764,"catteetude co.,ltd."
315377,e d u company limited
247618,"organic plus group (thailand) co.,ltd."
253972,"his msc co., ltd."
47891,return company limited.
1050343,show design company limited
472452,g & l building services company limited
465037,fine art jewelry company limited
696123,panicha company limited
88532,west international (thailand) company limited
909940,play and play company limited
186908,diana group company limited
50576,sharpener company limited
429577,euro holding company limited
457754,daedalus company limited
239282,"island construction co.,ltd."
271963,prompt film company limited
184691,i-house company limited
524170,kyowa(thailand) company limited
8741,"alliance network co., ltd."
111462,e-tab (thailand) company limited
272705,hard & soft company limited
324076,"leisure co.,ltd."
277711,head room production company limited
506933,"obm (thailand) co., ltd."
486367,"mass sales thailand co., ltd."
475121,export pack company limited
503012,dj lighting company limited
104242,ltd business integrate company limited
739157,swarovski scst company limited
750622,air people international company limited
376988,g & k trading company limited
257645,"m.k.t magnetic co., ltd."
520537,fa consultant company limited
734878,business vision company limited
990203,cadmetric company limited
257359,"living international co., ltd."
105095,gypman tech company limited
341344,module group company limited
1062218,sport x company limited
7530,growth communication company limited
262486,horizon marketing company limited
204741,"pro & pro engineer co.,ltd."
695799,president development company limited
515204,sun samui company limited
317718,hanjin shipping (thailand) company limited
362762,blue zebra company limited
613930,miracle herbs company limited
788303,metro systems corporation public company limited
209779,"green environergy co.,ltd."
1042771,star sanitaryware (thailand) company limited
1011678,asia broadband company limited
516983,m k g company limited
9215,animal world company limited
578288,cyber express company limited
801997,"click design co.,ltd."
429384,volo company limited
57878,smooth travel company limited
203505,"pro international co., ltd."
212540,gene company limited
692249,"north developer co., ltd."
261302,"jsim co.,ltd."
679841,next step company limited
94780,amazon web services (thailand) company limited
294290,east west consultant company limited
215390,"life space co.,ltd."
86116,troop company limited
171188,"international testing co., ltd."
9814,headquarters company limited
194296,"g space co.,ltd."
1017563,asia inspection & consultant company limited
620278,win plus plus company limited
938627,"bangkok komatsu sales co.,ltd."
804289,welcome phuket company limited
66187,street fashion company limited
51939,"cash and care (thailand) co., ltd."
208998,"green communications group co.,ltd."
1016398,asian economic company limited
295979,"global it support and services co.,ltd."
57457,produce company limited.
217589,"green group development co., ltd."
257378,"automation international co., ltd."
471695,p & c group (thailand) company limited
265333,"professional property consultant co., ltd."
149868,indochina hotel company limited
101215,"arj studio co.,ltd."
940579,"ban resort co.,ltd."
505671,mvp. international company limited
579293,k m c group company limited
374453,"qm support co.,ltd."
89257,"workshop interior co., ltd."
190192,"genius engineering co.,ltd."
596989,polar star company limited
64983,"m e e technology co., ltd."
258710,hock (thailand) company limited
377082,"bnl (thailand) co.,ltd."
599489,"krungthon sport international co., ltd."
299635,jita group company limited
420111,drk (thailand) company limited
505898,phuket island property company limited
528830,phuket hello company limited
690984,"p and d (thailand) co., ltd."
239415,kia group engineering (thailand) company limited
144310,ecolo city (thailand) company limited
741,thaiday dot com company limited
629317,"value max co.,ltd."
233578,"irving corporation co., ltd."
674970,yoshiban (thailand) company limited
47825,retirement home company limited
230477,"doi chaang original co.,ltd."
594928,krungthai panich insurance public company limited
46502,represent company limited
1012663,asia metal public company limited
331249,amber logistics company limited
52170,"cat mobile co.,ltd."
1070372,"sure telecom co.,ltd."
46160,"bikers group co.,ltd."
596167,yummy company limited
383621,"leader engineering ltd., part."
704978,bal company limited
245292,exquisite travel company limited
258909,cheer (thailand) company limited
59911,"scale design co., ltd."
376785,maikadok company limited
543031,lantern company limited
318269,getappeasy company limited
419123,sun rise company limited
111957,m stone company limited
675014,"axis z co.,ltd."
103796,in group company limited
563994,fragrant property company limited
329418,ratchata group company limited
448521,"p-g-l-m co., ltd."
299285,alfa geotech company limited
105975,"klong muang inn co., ltd."
994301,"chinteik brothers co., ltd."
375087,mon logistics group company limited
236567,"isb international co.,ltd."
106310,iben company limited
181932,if you can company limited
590131,"top project co.,ltd."
307840,modern works & cnc service limited partnership
898624,"bangkok banana co., ltd."
236714,"canvas creations co., ltd."
587312,yong thai
244059,i-support company limited
267987,easmed company limited
235033,green cluster company limited
478433,k p b k company limited
42336,detailing (thailand) company limited
85562,"part vision co.,ltd."
356945,redigen company limited
217055,"hitachi plant technologies (thailand) co.,ltd."
84261,operational energy group limited
214451,"at room co.,ltd."
563400,suntara company limited
569929,"boehringer ingelheim (thai) co., ltd."
67644,"submit engineering co., ltd."
449423,"munk co., ltd."
299581,"hks (thailand) co., ltd."
216021,geoharbour (thailand) company limited
470204,mana production company limited
89220,worker service company limited
345108,forming engineering company limited
306434,hafele (thailand) limited.
507758,"phuket travel club co.,ltd."
600902,r supply(thailand) company limited
322839,"dukuly brothers gems co.,ltd."
323603,"modern hair co.,ltd."
721701,pbl group(2015) company limited
1012943,china petroleum pipeline bureau (thailand) company limited
504892,victor packaging company limited
713580,design source company limited
542135,me up group company limited
292843,"double image 2005 co.,ltd."
46945,bond product company limited
46696,bluebik group company limited
118407,j.p. bosco ltd.
241038,detonics health company limited
284409,"jan group co., ltd."
432853,roland company limited
501830,a plus building solutions company limited
7405,"actor international co., ltd."
424526,we plus group (thailand) company limited
688272,"work engineering & construction co.,ltd."
465320,"digital business co.,ltd."
518682,victor chemet (thailand) company limited
1050139,"shop online co.,ltd."
576837,ziga innovation public company limited
239971,line instrument company limited
202130,integrate company limited
890456,chromosome laboratory center company limited
67639,senior profressional company limited
579252,pnc engineering & consultant (thailand) company limited
214126,"green property co., ltd."
500413,"ramindra department store co., ltd."
220945,"green business co., ltd."
1040634,"star k. k. ltd., part."
382591,andaman maritime services company limited
122842,kal group company limited
65299,"fellow group co.,ltd."
1075378,shichi sushi company limited
257331,live action company limited
726055,t-rex (thailand) company limited
1021758,c-long consulting engineering company limited
673189,network 21 company limited
473602,"p. construction co., ltd"
46716,"research product international co., ltd."
709119,prime service company limited
610417,natural yoga company limited
431777,"sundar trading co., ltd."
767732,vok (thailand) company limited
44827,illert project bangkok company limited
293324,hic(thailand) company limited
94367,greenery (thailand) company limited
259592,"automotive innovation (thailand) co., ltd."
298297,love beach company limited
389638,"rabbitive co.,ltd."
322565,"daily express co., ltd."
248136,"aim high group co., ltd."
475782,narit & associates ltd.
168992,"house of architects co.,ltd."
8590,psychology services bangkok company limited
8731,alliance bkk company limited
1080472,snapper company limited
310089,"d p k p group co.,ltd."
7739,"property focus co.,ltd."
58905,promise trading company limited
378606,beams technology company limited
504464,murphys company limited
363176,"data micro network co.,ltd."
234032,pam co company limited
562293,plus plus trading company limited
1009217,sokochan company limited
226038,"ipm films co., ltd."
509471,phuket fm radio company limited
46874,intelligence law company limited
221529,one p company limited
387653,entropy company limited
330142,for health network company limited
48522,eastern impex limited
816644,"mediamat ltd., part."
599646,"krung siam co., ltd."
49036,"buyer direct co.,ltd."
728624,private wealth company limited
758552,b w l (thailand) company limited
320393,orchidacea company limited
426355,euroasiatic siam company limited
311183,okumura metals (thailand) company limited
534852,meridian travel company limited
182613,"grand asia food industry co., ltd."
689109,delmar thai limited
93112,good entertainment (thailand) company limited
616109,at sydney company limited
270922,proud passion consulting company limited
736986,v d c company limited
96936,"actuator service co.,ltd."
758056,b.wish value company limited
100615,abc group company limited
7779,admissions office company limited
1078846,siddham export company limited
812690,meco group company limited
271917,project innovation company limited
203791,one to be company limited
554399,a r business company limited
909690,"play and music co., ltd."
910,li yang company limited
676973,"networks & security consulting co.,ltd."
264052,horton international company limited
719133,"pawin co., ltd."
239301,"island master co.,ltd."
239028,eagle group company limited
779317,kadokawa ca (thailand) company limited
444694,garant international company limited
676855,trade limited partnership
224001,auditor company limited
286301,fagus (thailand) company limited
353141,red energy company limited
801450,pum thai food chain company limited
223958,lima resort company limited
713418,des company limited
691717,panama & co company limited
1044313,"step up co.,ltd."
222791,proactive marketing [indochina] company limited
436245,quality flex company limited
68424,"control data systems (thailand) co., ltd."
383607,erawan group company limited
421318,"lionbridge (thailand) co.,ltd."
1043605,star english language company limited
458218,muse company limited
501767,mts gold company limited
674922,pacific data system company limited
497259,"devere & partners (thailand) co., ltd."
553856,sun intertrade (thailand) company limited
263957,"parts manufacturing co., ltd."
208534,futaba technology (thailand) company limited
703054,pandara company limited
8702,defense technology company limited
548206,"far co., ltd."
231930,"fujikura (thailand) co., ltd."
56678,etc professional company limited
214131,green spot company limited
196446,costa company limited
512845,ramino (thailand) company limited
276898,global origins company limited
327148,"blueberry group co.,ltd."
362046,monkey puzzle company limited
368417,four aces consultants company limited
281986,"kimpai lamitube co., ltd."
461318,"westech component co., ltd."
303547,gyde company limited
176991,"biodegradable packaging for environment co.,ltd."
1059596,smart world travel agent company limited
524882,mocking tales group company limited
363948,"ams international co.,ltd."
331347,infinity group (thailand) company limited
85697,party time (thailand) company limited.
744119,business textile company limited
1064228,suanluang
73106,furniture village company limited
563741,sun series (thailand) company limited
74752,"genetic plus co.,ltd."
63557,standard chartered bank (thai) public company limited
815957,"media insight co.,ltd."
1015916,asian management company limited
1027431,soul of asia company limited
53362,lean development company limited
273406,health and living company limited
466558,nuobello company limited
146784,home cooking company limited
310142,hakudo (thailand) company limited
230533,"green dot (thailand) co., ltd."
465184,"fine life co., ltd."
297901,fair chain company limited
577923,"lucky industrial co., ltd."
282599,"eastern water resources development and management co., ltd."
460648,"western tech co., ltd."
262270,osenew company limited
1077529,"space design co., ltd."
